{
  "$schema": "../../schemas/evidence_review_a1_m3_final_manifest_v1.schema.json",
  "additional_exclusions_created": false,
  "candidate_id": "a1_two_stage_coverage_entailment_v1",
  "decision_metrics": {
    "accept_precision": null,
    "accept_precision_status": "undefined_no_predicted_accepts",
    "accept_recall": 0.0,
    "accuracy": 0.43243243243243246,
    "confusion_matrix": {
      "fn": 21,
      "fp": 0,
      "tn": 16,
      "tp": 0
    },
    "false_accept_rate": 0.0,
    "false_reject_rate": 1.0,
    "predicted_accept_count": 0,
    "predicted_reject_count": 37,
    "question_count": 37
  },
  "evaluation_run_id": "mit60001_evidence_a1_m3_3c40e8e860ece53d",
  "evidence_selection": {
    "does_not_support_count": 0,
    "evidence_precision": null,
    "metric_status": "not_evaluable_zero_selected_pairs",
    "question_scope": "same_37_decision_evaluable_questions",
    "selected_pair_count": 0,
    "stage2_requirement_ids_included": false,
    "supports_count": 0,
    "unit": "final_selected_question_chunk_pair"
  },
  "ground_truth_modified": false,
  "human_review_workbook_created": false,
  "input_sha256": {
    "a1_entailment": "92222d15a87d102ce00189d048b8b40fe2c2cb9fcf659f5876a85c4cda6c09e7",
    "a1_manifest": "ac65e8223ce12f9308e86f0599c289a0b95864289d27c2c9caaeec93233a80a2",
    "a1_reviews": "842e82cdba9c8480e83fe37ad8d832fb9e978223786b0e619119c9036d15e225",
    "canonical_decisions": "9e0b5211ea0c1a760dc0cb1882b6d3eb30c1ec5d78879e07640c9e2ab6f922b6",
    "evaluator": "ba0b8252c1485effb229dc9dd0c1097ba5270c207d56af1cd751f4925724f419",
    "manifest_schema": "368fc0e34f51f8c3e133a0a8acf4dcadb3eecc457258846a394a5ba76cc3f286",
    "request_package": "1cafc735ec5a40cf0179c017f064dd9cd3d187f0a4b90564d68680928e257a3e",
    "response_schema": "ce7dd6aafe3667f9fbc33b097d1a6747c2eb165a7bc02034da23a1336a0133cf",
    "thresholds": "0d31e3e05d91467fde507264f7382a456fd75961280cb5f3216dbfc699ddf0c1"
  },
  "model_calls": 0,
  "output_artifacts": [
    {
      "file": "reports/19_evidence_reviewer_a1_evaluation/a1_decision_results.csv",
      "sha256": "08caaee9660eec0cef92e6bc5c1c3f0212bf32b43f461fb3b7b7373336655586"
    },
    {
      "file": "reports/19_evidence_reviewer_a1_evaluation/a1_final_metrics.json",
      "sha256": "117705d945b4404e4d639c4e37ac5b38e23b235f59eef051af0de9bde762dce4"
    },
    {
      "file": "reports/19_evidence_reviewer_a1_evaluation/a1_stage2_internal_audit.json",
      "sha256": "507140d3717d2212e16c8ee648c286220c4ed434f0bd668c81083b2c43d939e8"
    }
  ],
  "quality_gate": {
    "accept_recall": {
      "status": "fail",
      "threshold_min": 0.75,
      "value": 0.0
    },
    "evidence_selection_precision": {
      "selected_pair_count": 0,
      "status": "not_evaluable",
      "threshold_min": 0.85,
      "value": null
    },
    "failed_thresholds": [
      "accept_recall"
    ],
    "failure_mode": "reject_class_collapse",
    "false_accept_rate": {
      "status": "pass",
      "threshold_max": 0.25,
      "value": 0.0
    },
    "generalization_claim_allowed": false,
    "interpretation": "no_tried_configuration_reached_the_frozen_thresholds",
    "not_evaluable_metrics": [
      "evidence_selection_precision"
    ],
    "overall_status": "failed_candidate",
    "production_ready_claim_allowed": false,
    "runtime_schema": {
      "status": "pass"
    }
  },
  "reviewer_research_status": "stopped_after_a1_per_frozen_rule",
  "schema_version": "evidence_review_a1_m3_final_manifest_v1",
  "scope": {
    "additional_exclusions_allowed": false,
    "development_question_count": 40,
    "evaluated_question_count": 37,
    "excluded_question_ids": [
      "mit60001-q-017",
      "mit60001-q-023",
      "mit60001-q-041"
    ],
    "expected_accept_count": 21,
    "expected_reject_count": 16
  },
  "source_experiment_run_id": "mit60001_evidence_a1_experiment_607102394851e012",
  "stage2_internal_audit": {
    "final_selected_pair_metric_includes_internal_ids": false,
    "interpretation": "internal_debug_only_not_evidence_precision_input",
    "question_count": 40,
    "questions_with_all_requirements_supported": 0,
    "questions_with_at_least_one_supported_requirement": 20,
    "requirement_assessment_count": 103,
    "schema_version": "evidence_review_a1_stage2_internal_audit_v1",
    "supported_requirement_count": 21,
    "unsupported_requirement_count": 82
  },
  "validation_status": "passed"
}
